1,Human Society,Fund Raiser,24-Feb-24,Support Spay and Neuter Day,"Nullam id pellentesque ante. Vestibulum in convallis mauris.Duis dolor augue, varius eget gravida eu, ullamcorper vitae sem. Curabitur eleifend maximus finibus. Phasellus sagittis porttitor augue ut commodo.Duis dolor augue, varius eget gravida eu, ullamcorper vitae sem. ",files/images/events/animal1.jpg
2,Outdoor Skating Group,Sports,25-Feb-24,Come Skate on the Oval,"Nunc vel commodo sapien. Phasellus ac enim sit amet ligula congue scelerisque sit amet quis tellus.Ut tincidunt nibh sapien, nec interdum eros fringilla in. ",files/images/events/skate3.jpg
3,NS Ski School,Sports,27-Feb-24,Learn to Ski,"Aliquam consequat, est et posuere maximus, magna arcu dapibus justo.",files/images/events/ski6.jpg
4,Eat Local,Food,28-Feb-24,Food/Wine Pairing,"Aenean odio ante, efficitur vel porttitor id, imperdiet ut urna. Ut tincidunt nibh sapien, nec interdum eros fringilla in. Cras accumsan rutrum arcu ac congue. Integer finibus velit eu elementum rutrum.",files/images/events/food1.jpg
5,Dance NS,Art+Culture,1-Mar-24,Exhibition of Local Dance,Sed sit amet urna sed nisl lobortis pharetra sit amet at nulla. Nulla euismod elit in mauris dignissim auctor. Aenean a diam non turpis mollis auctor ac quis est.,files/images/events/dance1.jpg
6,Youth Band,Fund Raiser,8-Mar-24,Local Bands compete to raise fund for national competition,"Ut ligula metus, pretium non dapibus dictum, rutrum at magna. Pellentesque et lorem in diam pharetra cursus eget et ex. Integer finibus velit eu elementum rutrum.",files/images/events/music1.jpg
7,Nocturne Association,Fund Raiser,12-Mar-24,Auction of local art to support local artists,"Quisque vel rutrum est. Donec in turpis nec enim tincidunt eleifend vel eu nunc.Varius eget gravida eu, ullamcorper vitae sem.",files/images/events/art1.jpg
8,"Human Society","Fund Raiser",02-May-2024,"Meet, Greet and Adopt Day","uirhgkeurfhajfa, ehfhrifjkrjawj",files/images/events/animal5.jpg
